MCQ,Choices,Correct
Who coined the term 'machine learning'?,a: Donald Hebb | b: Raytheon Company | c: Arthur Samuel | d: Tom M. Mitchell,c
What was the name of the experimental 'learning machine' developed by Raytheon Company in the early 1960s?,a: Cybertron | b: HAL 9000 | c: Skynet | d: Deep Blue,a
Who proposed the early mathematical models of neural networks that influenced modern machine learning technologies?,a: Walter Pitts | b: Warren McCulloch | c: Donald Hebb | d: Arthur Samuel,a
"According to Tom M. Mitchell, what is the definition of a computer program learning from experience?",a: Improving performance with experience E | b: Learning from textbooks | c: Copying human behavior | d: Ignoring past experiences,a
What are the two objectives of modern-day machine learning?,a: To confuse data and make random predictions | b: To classify data and make predictions for future outcomes | c: To play video games and watch movies | d: To cook meals and do laundry,b
